{
  "schema_version": "1.0",
  "task": "revision",
  "input_hash": "c00ac76a62521b24ac843a572e3da701ffce6523043c5c7ee87e392beda6938a",
  "summary": "删去重复解释，以取票动作承接犹豫；保留渡船和未决的结尾。",
  "edits": [
    {
      "id": "E1",
      "before": "她很紧张，她不知道要不要走。",
      "occurrence": 1,
      "after": "折痕已经发白。她把信塞进衣袋，手仍留在袋口。",
      "rationale": "用反复折信的痕迹和停住的手表现犹豫，不交代信的内容。"
    },
    {
      "id": "E2",
      "before": "阿禾低下头，攥着信，一句话也说不出来。",
      "occurrence": 1,
      "after": "阿禾把零钱放上窗台。半落的窗板挡住了她的手，她没有收回。",
      "rationale": "让人物通过一个尚未完成的动作回应拒绝；是否上船仍未确定。零钱是新增的小道具，作者可保留原文。"
    },
    {
      "id": "E3",
      "before": "她很紧张，她不知道要不要走。",
      "occurrence": 2,
      "after": "",
      "rationale": "删除第二次相同解释，让窗口的停顿继续承受压力。"
    }
  ],
  "questions": [
    "零钱是新增道具，是否符合原稿设定？如不符合，请保留 E2 原文。"
  ]
}
