{
  "schema_version": "1.0",
  "task": "inspiration",
  "input_hash": "39319e7699cb641364fee6c725485ee0ca587de1f56720aa0d32bfd2d0c5c591",
  "summary": "两个方向都从售票员擅长安排别人、推迟自己出发，结局交给作者。",
  "content": "# 方向一：留下的人\n售票员发现错过船的乘客正是自己一直避开的旧友。她可以帮对方找车离开，也可以承认自己把那封邀请信放了多年。\n\n代价：坦白可能结束旧友对这段关系的期待，不能把说出口自动写成和解。\n\n# 方向二：不再替人决定\n一名乘客抱怨售票员替自己选了更晚的班次，错过了原本要做的告别。售票员必须承认，她把自己的拖延习惯包装成了体贴。\n\n代价：道歉无法补回时间；行动可以是退票、帮忙联络，或诚实地承认无能为力。",
  "notes": [
    "第一条侧重关系中的隐瞒，第二条侧重日常权力和承担后果。",
    "两条均可使用日常交通事件展开，无需神迹。"
  ],
  "assumptions": [
    "旧友和邀请信、替乘客选择班次都是不同方向的新设定，不能自动视作原稿事实。"
  ],
  "questions": [
    "你想写关系中的遗憾，还是一次善意越界后的承担？"
  ]
}
