{
  "schema_version": "1.0",
  "task": "outline",
  "input_hash": "d3e5aa77a51994f0a01fd012e2a93912e4f1a45feca9179b9a5f042636a54801",
  "summary": "以失物登记的日常程序承载时间异常，把结尾落在一次值守选择上。",
  "content": "# 最后一栏\n\n## 核心冲突\n她能提前找到东西，却无法替失主决定是否回来。拆站期限逼迫她决定：清单上没有出现的人，是否值得继续等。\n\n## 场景一：多出的一行\n开站前，她按清单找回一把仍未遗失的伞。清单最后一栏只有空白。\n\n## 场景二：退还\n她把伞提前递给旅客，对方因此错过列车。一次善意第一次改变了她自以为可靠的程序。\n\n## 场景三：交接\n拆站负责人要她清空失物柜。她把无人认领的物品逐一登记，却不肯为那一栏填上“无”。\n\n## 场景四：关灯以前\n最后一班车开走，清单再没变化。她将柜门钥匙放在值班室窗沿，留下一盏灯。没有人现身，故事在等待本身结束。",
  "notes": [
    "四个场景都让值班员作出可观察的选择。",
    "不解释清单来历，也不把等待保证成团圆。"
  ],
  "assumptions": [
    "新增雨伞、失物柜和拆站交接压力，均为创作提案。"
  ],
  "questions": [
    "主角与未出现的失主是否已有关系？当前版本保留未知。"
  ]
}
