{
  "schema_version": "1.0",
  "task": "revision",
  "input_hash": "f9c4f7b74f241e776d2afd96d323f1fed038fed1248cbca655c3d93763abc707",
  "summary": "只提出两处轻修：收紧一句情绪表达，另提供一个句读选择。两处均由作者决定是否采用。保留第一人称、两次‘明天再说’、没有开门的结尾，以及信件来源的留白。",
  "questions": [],
  "edits": [
    {
      "id": "E1",
      "before": "我觉得特别难过，像一个非常悲伤的人",
      "occurrence": 1,
      "after": "我觉得很难过",
      "rationale": "‘像一个非常悲伤的人’再次说明了难过，没有增加可感知的细节。收短后仍直接保留‘我’的情绪，让前面的烫杯子与后面的窗雾继续承载这一刻。若这种略显生硬的自我观察正是叙述者的口吻，可保留原句。"
    },
    {
      "id": "E2",
      "before": "窗上的雾越来越厚，我没有开门。",
      "occurrence": 1,
      "after": "窗上的雾越来越厚。我没有开门。",
      "rationale": "仅把逗号改为句号，让‘我没有开门’得到一次独立停顿，动作与人物关系均不变。原逗号的连贯感也成立，这是节奏上的可选取舍。"
    }
  ]
}
