{
  "schema_version": "1.0",
  "task": "male_gaze",
  "input_hash": "f6ea0da4442fc2e6e35a03723fc43d85d57bd9d995cc4d0fffec9ba1a7dcaa20",
  "summary": "保留工人的凝视作为阻力，把叙事注意力交还给技师的故障判断。",
  "edits": [
    {
      "id": "E1",
      "before": "她走进修船棚，工人们盯着她的腰。她只能红着脸站着。",
      "occurrence": 1,
      "after": "她走进修船棚，工人的目光让她在门口停了一下。棚内滴水的声音断断续续，她循着声音看向船底，握紧了手里的粉笔。",
      "rationale": "没有抹除被审视的处境；把身体当作展示对象的叙述改为她感到的阻力和主动观察。粉笔沿用后文道具。"
    }
  ],
  "questions": [
    "停在门口的犹豫是否符合人物当时的状态？"
  ]
}
